{
  "$schema": "https://json-schema.org/draft/2020-12/schema",
  "$id": "https://goodz.systems/schemas/goodz-config.schema.json",
  "title": "Goodz Platform Configuration",
  "type": "object",
  "additionalProperties": false,
  "required": ["version", "product", "platform", "references", "portability"],
  "properties": {
    "$schema": { "type": "string" },
    "version": { "enum": [1, 2] },
    "product": {
      "type": "object",
      "additionalProperties": false,
      "required": ["name", "edition", "description"],
      "properties": {
        "name": { "const": "Goodz" },
        "edition": { "enum": ["core", "cloud", "enterprise"] },
        "description": { "type": "string", "minLength": 1 }
      }
    },
    "platform": {
      "type": "object",
      "additionalProperties": false,
      "required": ["modelPackage", "consoleApp", "apiPrefix", "sourceOfTruth"],
      "properties": {
        "modelPackage": { "const": "@goodz/process" },
        "consoleApp": { "type": "string", "minLength": 1 },
        "apiPrefix": { "const": "/api/process" },
        "sourceOfTruth": { "type": "string", "minLength": 1 },
        "internalReference": {
          "type": "object",
          "additionalProperties": false,
          "required": ["id", "name", "statusPath", "metricsPath"],
          "properties": {
            "id": { "type": "string", "minLength": 1 },
            "name": { "type": "string", "minLength": 1 },
            "statusPath": { "type": "string", "minLength": 1 },
            "metricsPath": { "type": "string", "minLength": 1 }
          }
        }
      }
    },
    "references": {
      "type": "array",
      "items": {
        "type": "object",
        "additionalProperties": false,
        "required": ["id", "name", "domain", "typePackage", "apps", "apiPrefix"],
        "properties": {
          "id": { "type": "string", "minLength": 1 },
          "name": { "type": "string", "minLength": 1 },
          "domain": { "type": "string", "minLength": 1 },
          "typePackage": { "type": "string", "minLength": 1 },
          "apps": {
            "type": "array",
            "minItems": 1,
            "items": { "type": "string", "minLength": 1 }
          },
          "apiPrefix": { "type": "string", "minLength": 1 }
        }
      }
    },
    "portability": {
      "type": "object",
      "additionalProperties": false,
      "required": ["coreChangesAllowedForNewReference", "coreContract", "requiredCommands"],
      "properties": {
        "coreChangesAllowedForNewReference": { "const": false },
        "coreContract": {
          "type": "object",
          "additionalProperties": false,
          "required": ["version", "path", "sha256"],
          "properties": {
            "version": { "type": "string", "minLength": 1 },
            "path": { "type": "string", "minLength": 1 },
            "sha256": { "type": "string", "pattern": "^[a-f0-9]{64}$" }
          }
        },
        "requiredCommands": {
          "type": "array",
          "minItems": 1,
          "items": { "type": "string", "minLength": 1 }
        }
      }
    },
    "delivery": {
      "type": "object",
      "additionalProperties": false,
      "required": ["exportRoot", "manifestRoot", "git"],
      "properties": {
        "exportRoot": { "const": "docs/projects" },
        "manifestRoot": { "const": ".goodz/exports" },
        "git": {
          "type": "object",
          "additionalProperties": false,
          "required": ["remote", "base", "branchPrefix"],
          "properties": {
            "remote": { "type": "string", "minLength": 1 },
            "base": { "type": "string", "minLength": 1 },
            "branchPrefix": { "type": "string", "minLength": 1 }
          }
        }
      }
    }
  },
  "allOf": [
    {
      "if": { "properties": { "version": { "const": 2 } } },
      "then": { "required": ["delivery"] }
    }
  ]
}
